{
  "$schema": "https://json-schema.org/draft/2020-12/schema",
  "type": "object",
  "additionalProperties": false,
  "required": [
    "task_id",
    "conclusion",
    "result",
    "claimed_assurance",
    "scope",
    "completeness",
    "evidence",
    "limitations"
  ],
  "properties": {
    "task_id": {
      "const": "jacobian/symmetry-identity-subgroup"
    },
    "conclusion": {
      "const": "TRUE"
    },
    "result": {
      "type": "object",
      "additionalProperties": false,
      "required": [
        "vertex_orbits",
        "edge_orbits"
      ],
      "properties": {
        "vertex_orbits": {
          "type": "array",
          "items": {
            "type": "array",
            "items": {
              "type": "string"
            }
          }
        },
        "edge_orbits": {
          "type": "array",
          "items": {
            "type": "array",
            "items": {
              "type": "array",
              "items": {
                "type": "string"
              }
            }
          }
        }
      }
    },
    "claimed_assurance": {
      "enum": [
        "UNVERIFIED",
        "COMPUTED",
        "CHECKED"
      ]
    },
    "scope": {
      "const": "jacobian/symmetry-identity-subgroup complete finite input"
    },
    "completeness": {
      "const": "COMPLETE"
    },
    "evidence": {
      "type": "array",
      "minItems": 1,
      "items": {
        "type": "object",
        "additionalProperties": false,
        "required": [
          "path",
          "sha256"
        ],
        "properties": {
          "path": {
            "const": "evidence/answer.txt"
          },
          "sha256": {
            "type": "string",
            "pattern": "^sha256:[0-9a-f]{64}$"
          }
        }
      }
    },
    "limitations": {
      "type": "array",
      "items": {
        "type": "string"
      }
    }
  }
}
